{
  "$schema": "https://json-schema.org/draft/2020-12/schema",
  "title": "ProjectMap",
  "description": "Routing index generado por analyzers/project.py. Consumido por reader.md para activar sub-readers.",
  "type": "object",
  "additionalProperties": false,
  "required": ["name", "architecture", "stack", "entry_points", "domains"],
  "properties": {
    "name":         { "type": "string" },
    "description":  { "type": "string" },
    "languages":    { "type": "array", "items": { "type": "string" } },
    "stack": {
      "type": "object",
      "additionalProperties": { "type": "string" }
    },
    "architecture": {
      "type": "string",
      "description": "Cadena de capas. Ej: BLUEPRINTS → CONTROLLERS → MANAGERS → [DB | Redis]"
    },
    "entry_points": { "type": "array", "items": { "type": "string" } },
    "domains": {
      "type": "object",
      "description": "Dominios disponibles. El reader hace match de trigger_keywords contra el prompt para decidir qué sub-readers activar.",
      "additionalProperties": {
        "type": "object",
        "required": ["map", "reader", "summary", "trigger_keywords"],
        "additionalProperties": false,
        "properties": {
          "map":              { "type": "string" },
          "reader":           { "type": "string" },
          "summary":          { "type": "string" },
          "trigger_keywords": { "type": "array", "items": { "type": "string" }, "minItems": 1 }
        }
      }
    },
    "modules": {
      "type": "object",
      "description": "Índice de archivos por rol. Claves son el rol asignado por FileInfo.",
      "additionalProperties": {
        "type": "array",
        "items": {
          "type": "object",
          "required": ["path", "purpose", "search_keywords", "symbols", "test_file", "related_to"],
          "additionalProperties": false,
          "properties": {
            "path":            { "type": "string" },
            "purpose":         { "type": "string" },
            "search_keywords": { "type": "array", "items": { "type": "string" } },
            "symbols": {
              "type": "array",
              "items": {
                "type": "object",
                "required": ["name", "line", "kind"],
                "additionalProperties": false,
                "properties": {
                  "name": { "type": "string" },
                  "line": { "type": "integer" },
                  "kind": { "type": "string", "enum": ["class", "function"] }
                }
              }
            },
            "test_file":  { "type": ["string", "null"] },
            "related_to": { "type": "array", "items": { "type": "string" } }
          }
        }
      }
    },
    "problems": {
      "type": "array",
      "description": "Señales de riesgo detectadas en archivos de lógica.",
      "items": {
        "type": "object",
        "required": ["file", "type", "description"],
        "additionalProperties": false,
        "properties": {
          "file":        { "type": "string" },
          "type":        { "type": "string", "enum": ["god_object", "no_tests"] },
          "description": { "type": "string" }
        }
      }
    },
    "hotspots": {
      "type": "array",
      "items": {
        "type": "object",
        "required": ["file", "commits"],
        "properties": {
          "file":    { "type": "string" },
          "commits": { "type": "integer" }
        }
      }
    },
    "cochange": {
      "type": "object",
      "additionalProperties": { "type": "array", "items": { "type": "string" } }
    }
  }
}
