{
  "name": "panchi-bot",
  "description": "Bot de WhatsApp para gestión de pedidos de un restaurante en Tarancón (España). Los clientes interactúan por WhatsApp, seleccionan productos desde un menú web y pagan con Monei.",
  "languages": [
    "python",
    "javascript"
  ],
  "stack": {
    "Sentry": "2.54.0",
    "SQLAlchemy": "2.0.38",
    "Tenacity": "9.1.4",
    "aiohttp": "3.11.13",
    "Flask": "3.1.0",
    "httpx": "0.28.1",
    "Pydantic": "2.10.6",
    "Redis": "5.2.1",
    "requests": "2.32.3",
    "Twilio": "9.4.6"
  },
  "architecture": "BLUEPRINTS → CONTROLLERS → SERVICES → MANAGERS → [DB | Redis | APIs externas]",
  "entry_points": [
    "main.py"
  ],
  "hotspots": [
    {
      "file": "managers/gestor_dashboard.py",
      "commits": 41
    },
    {
      "file": "main.py",
      "commits": 31
    },
    {
      "file": "templates/confirmacion_pago.html",
      "commits": 24
    },
    {
      "file": "templates/quiniela.html",
      "commits": 22
    },
    {
      "file": "templates/repartidor/index.html",
      "commits": 20
    },
    {
      "file": "templates/dashboard/index.html",
      "commits": 20
    },
    {
      "file": "controllers/mensajes_registrados.py",
      "commits": 19
    },
    {
      "file": "blueprints/webhook.py",
      "commits": 17
    },
    {
      "file": "models.py",
      "commits": 16
    }
  ],
  "cochange": {
    "managers/gestor_dashboard.py": [
      "managers/gestor_dashboard.py",
      "main.py",
      "templates/confirmacion_pago.html"
    ],
    "templates/repartidor/index.html": [
      "managers/gestor_dashboard.py",
      "main.py",
      "templates/confirmacion_pago.html"
    ],
    "blueprints/repartidor.py": [
      "managers/gestor_dashboard.py",
      "main.py",
      "templates/confirmacion_pago.html"
    ],
    "templates/picker/index.html": [
      "managers/gestor_dashboard.py",
      "main.py",
      "templates/confirmacion_pago.html"
    ],
    "blueprints/picker.py": [
      "managers/gestor_dashboard.py",
      "main.py",
      "templates/confirmacion_pago.html"
    ],
    "blueprints/dashboard.py": [
      "managers/gestor_dashboard.py",
      "main.py",
      "templates/confirmacion_pago.html"
    ],
    "scripts/crear_pedidos_demo.py": [
      "managers/gestor_dashboard.py",
      "main.py",
      "templates/confirmacion_pago.html"
    ],
    "scripts/crear_pedidos_demo_pagados.py": [
      "managers/gestor_dashboard.py",
      "main.py",
      "templates/confirmacion_pago.html"
    ],
    "templates/dashboard/index.html": [
      "managers/gestor_dashboard.py",
      "main.py",
      "templates/confirmacion_pago.html"
    ],
    "templates/dashboard/turnos.html": [
      "managers/gestor_dashboard.py",
      "main.py",
      "templates/confirmacion_pago.html"
    ],
    "tests/test_dashboard_sprint6.py": [
      "managers/gestor_dashboard.py",
      "main.py",
      "templates/confirmacion_pago.html"
    ],
    "templates/dashboard/estadisticas.html": [
      "managers/gestor_dashboard.py",
      "main.py",
      "templates/confirmacion_pago.html"
    ],
    "tests/test_dashboard_sprint5.py": [
      "managers/gestor_dashboard.py",
      "main.py",
      "templates/confirmacion_pago.html"
    ],
    "scripts/seed_turnos_ui.sql": [
      "managers/gestor_dashboard.py",
      "main.py",
      "templates/confirmacion_pago.html"
    ],
    "templates/dashboard/historial.html": [
      "managers/gestor_dashboard.py",
      "main.py",
      "templates/confirmacion_pago.html"
    ],
    "templates/macros/ui.html": [
      "managers/gestor_dashboard.py",
      "main.py",
      "templates/confirmacion_pago.html"
    ]
  },
  "domains": {
    "project": {
      "map": "PROJECT_MAP.json",
      "reader": "project-reader",
      "summary": "Architecture, modules, flow and general structure",
      "trigger_keywords": [
        "architecture",
        "structure",
        "module",
        "flow",
        "overview",
        "general"
      ]
    },
    "db": {
      "map": "DB_MAP.json",
      "reader": "db-reader",
      "summary": "Tables, models, migrations and DB schema",
      "trigger_keywords": [
        "database",
        "db",
        "table",
        "model",
        "migration",
        "schema",
        "column"
      ]
    },
    "query": {
      "map": "QUERY_MAP.json",
      "reader": "query-reader",
      "summary": "Queries, data access patterns and performance",
      "trigger_keywords": [
        "query",
        "sql",
        "select",
        "performance",
        "data access",
        "orm"
      ]
    },
    "ui": {
      "map": "UI_MAP.json",
      "reader": "ui-reader",
      "summary": "Views, components and UI states",
      "trigger_keywords": [
        "ui",
        "view",
        "component",
        "template",
        "frontend",
        "html",
        "css",
        "form"
      ]
    },
    "api": {
      "map": "API_MAP.json",
      "reader": "api-reader",
      "summary": "API endpoints, blueprints, webhooks and middleware",
      "trigger_keywords": [
        "api",
        "endpoint",
        "route",
        "blueprint",
        "webhook",
        "http",
        "rest"
      ]
    },
    "services": {
      "map": "SERVICES_MAP.json",
      "reader": "services-reader",
      "summary": "External integrations and service adapters",
      "trigger_keywords": [
        "service",
        "integration",
        "external",
        "third-party",
        "adapter",
        "client"
      ]
    },
    "jobs": {
      "map": "JOBS_MAP.json",
      "reader": "jobs-reader",
      "summary": "Background jobs, scheduled tasks and queues",
      "trigger_keywords": [
        "job",
        "task",
        "cron",
        "schedule",
        "queue",
        "background",
        "worker",
        "async"
      ]
    }
  },
  "modules": {},
  "problems": []
}
