{
  "name": "losgretis",
  "description": "",
  "languages": [
    "python"
  ],
  "architecture": "Arquitectura no inferida — revisar estructura de carpetas",
  "stack": {},
  "entry_points": [],
  "domains": {
    "db": {
      "map": "DB_MAP.json",
      "reader": "db-reader",
      "summary": "0 modelos None",
      "trigger_keywords": [
        "modelo",
        "tabla",
        "migración",
        "campo",
        "relación",
        "ORM",
        "schema",
        "base de datos",
        "database",
        "migration",
        "model",
        "table",
        "field",
        "relationship",
        "SQLAlchemy",
        "Prisma",
        "TypeORM"
      ]
    },
    "query": {
      "map": "QUERY_MAP.json",
      "reader": "query-reader",
      "summary": "15 archivos con acceso a datos, patrón: Manager / Repository",
      "trigger_keywords": [
        "consulta",
        "query",
        "filtro",
        "join",
        "rendimiento",
        "índice",
        "filter",
        "performance",
        "index",
        "select",
        "aggregate",
        "repository",
        "manager",
        "acceso a datos",
        "data access"
      ]
    },
    "ui": {
      "map": "UI_MAP.json",
      "reader": "ui-reader",
      "summary": "0 archivos de UI en 0 carpetas",
      "trigger_keywords": [
        "vista",
        "componente",
        "pantalla",
        "formulario",
        "plantilla",
        "frontend",
        "view",
        "component",
        "template",
        "page",
        "layout",
        "UI",
        "interfaz",
        "interface",
        "render",
        "HTML",
        "CSS"
      ]
    },
    "api": {
      "map": "API_MAP.json",
      "reader": "api-reader",
      "summary": "0 blueprints, 0 endpoints",
      "trigger_keywords": [
        "endpoint",
        "ruta",
        "blueprint",
        "HTTP",
        "request",
        "response",
        "webhook",
        "API",
        "route",
        "GET",
        "POST",
        "PUT",
        "DELETE",
        "PATCH",
        "REST",
        "controller",
        "handler",
        "middleware"
      ]
    },
    "services": {
      "map": "SERVICES_MAP.json",
      "reader": "services-reader",
      "summary": "0 integraciones externas",
      "trigger_keywords": [
        "servicio",
        "integración",
        "externo",
        "Twilio",
        "Stripe",
        "Redis",
        "Monei",
        "SMS",
        "email",
        "pago",
        "payment",
        "service",
        "integration",
        "external",
        "SDK",
        "API externa",
        "tercero",
        "third-party"
      ]
    },
    "jobs": {
      "map": "JOBS_MAP.json",
      "reader": "jobs-reader",
      "summary": "Scheduler: ninguno, 1 jobs",
      "trigger_keywords": [
        "tarea",
        "job",
        "celery",
        "queue",
        "cola",
        "cron",
        "programado",
        "worker",
        "scheduled",
        "task",
        "background",
        "async task",
        "periodic",
        "interval"
      ]
    }
  },
  "cochange": {
    "claude/hooks/pre-commit.py": [],
    "claude/hooks/tests/test_validate.py": [
      "claude/hooks/pre-commit.py"
    ],
    "claude/hooks/validate.py": [
      "claude/hooks/pre-commit.py"
    ],
    "claude/hooks/analyze-repo.py": [
      "claude/hooks/pre-commit.py"
    ],
    "claude/hooks/analyzers/jobs.py": [
      "claude/hooks/pre-commit.py"
    ],
    "claude/hooks/tests/test_analyzer_jobs.py": [
      "claude/hooks/pre-commit.py"
    ],
    "claude/hooks/analyzers/services.py": [
      "claude/hooks/pre-commit.py"
    ]
  },
  "hotspots": [
    {
      "file": "claude/hooks/pre-commit.py",
      "commits": 7
    },
    {
      "file": "claude/hooks/execute-plan.py",
      "commits": 6
    }
  ]
}
